Book,Date,Pg. Number,Document Pg. Number,Header,Entry
Diary 1954-1861,Section 1: Weimar,,,N/A,
Diary 1954-1861,1854-07-20,14-15,39-40,N/A,Box Link: https://unl.box.com/s/j0zynl9nj9cp4xrl498oz4n1q3pe1wmw Omeka Link: https://georgeeliotarchive.org/admin/items/show/3150
Diary 1954-1861,1854-07-22,15-16,40-41,N/A,"22nd. We went to the Museum and saw Rubens's Crucifixion, even more
beautiful to me than the Descent from the Cross. These two pictures profoundly impressed me with the miserable lack of breadth and grandeur in the conceptions of our living artists. The reverence for the old masters is not all humbug and superstition. At the Church of St. Paul we saw some marvellous wood carving by Verbruggen. For roundness, grace and expression I have rarely seen anything equal to it even in marble. On the outside of this church, there is an elaborate representation of Calvary- puerile, like the faith it embodies, but impressive, like everything else that attempts -even if it only attempts - to make the past vividly present. At the church of St.Jacques we saw the famous altar-piece - a Holy Family presenting portraits ofRubens, his two wives, and his Father (as Time). At the Museum, we were rather disappointed in the bull's head (in the adoration of the Magi) so much lauded by Ruskin. He dwells on the simplicity of the means by which Rubens has here produced so striking an effect - the few bold dashes of the brush by which the head is made to stand out with such reality in the picture. But on examination the texture does not appear so slight as he leads one to expect. A picture of Card-players by Valentin was the only thing that delighted us here, besides the Crucifixion. We took our coffee in
the Café Français and spent our evening in listening to an excellent band which was serenading the Governor on the occasion ofhis being knighted."
Diary 1954-1861,1854-07-23,16,41,N/A,"23. Sunday. We were grilled in the Railway carriage this morning on our way to Brussels, and glad to find ourselves havened in the comfortable Hotel de Belgique, kept by a Mlle van Stockeran. On walking out in the evening we were struck with the palatial appearance of the Haute Ville, especially in the Rue Royale, and around the Park. Standing against the statue of the Comte de Belliard, we saw the sun set behind the spire of the Hotel de Ville - a spire which reminded me of Scott's monument at Edinburgh . Then we went to a concert in the Park, and en joyed seeing the people looking cheerful at their little tables with their glass oflemonade or sirop, or their cup of coffee."
Diary 1954-1861,1854-07-24,16,41,N/A,"24. We rambled about the town from breakfast till 1. St. Gudule, the principal church, is very magnificent. The front is a fine specimen of Gothic and the interior, which is very carefully and tastefully kept is rich in fine effects of painted glass, seen through labyrinthine arches. Orange trees are ranged along each side of the nave. We found the Basse Ville very picturesque - the Grand Place where stands the Hotel de Ville especially fine. A gallery or arcade of shops - La galérie de la Reine- is remarkably elegant. We strolled into the Marché aux Fleurs and there bought some cheap French novels. Our aching legs and melting bodies at last reached the Pare, where we rested under the shade a little while and then came home to dinner. A cavalry officer is the only other inmate of our hotel. In the evening we walked to the Zoological Gardens flattering ourselves that we were going to hear a concert by the band of the ""Guides""; but we were only just in time to see them quit the orchestra. However we had a pretty view of houses, trees and water from the gardens, and were consoled for our disappointment by the pleasure we had in strolling through the Basse Ville by starlight. The smells in the streets are sickening."
Diary 1954-1861,1854-07-25&26,16,41,N/A,"25 and 26. Short rambles in the morning, lying melting on our beds through the middle of the day, and our one evening resort, the concert in the Park filled up these two days. We saw the famous Mannikin and took chocolate at the Cafe aux Milles Colonnes; went to the Messageries to inquire about our luggage with
no other result than a colloquy with a hideous, uncivil man installed there as
chief functionary."
Diary 1954-1861,1854-07-27,16-17,41-42,N/A,"27 Thursday. We rose at sand set off for Namur. Our companions in the 2nd class carriage were some disgustingly coarse Belgians with baboonish children. Passed a train full of soldiers who set up a hideous howl, meant for singing. Every attempt at vocal music which we have happened to hear in Belgium has been of the same sort. When we reached Namur, it still rained a little, but after we had dined we managed to take a survey of the town, and to walk up a hill close to the fortifications from which we had a pleasant view suggestive of quiet industry. Our railway journey along the Meuse served to show us how much beauty there is on its banks, but was too rapid to allow of our enjoying it. The saloon, with its sofas and glass sides is a perfect contrivance. About s we reached the Hotel de l'Europe at Liege and had our tea in my bedroom, from the window of which there is an enchanting view of rich and varied foliage flanked by stately heights covered with buildings. We spent the evening in walking about Liege and were in a state of rapture at its beauty-entirely unlike anything we had seen before. The rich green everywhere breaking the lines of the picturesque houses, the amphitheatre of richly wooded hills which surround the valley of the Meuse and of which one catches sight here and there at the end of a street, the fine Boulevard leading to the river-everything we saw was beautiful. We determined to stay here through Friday and defer our departure for Cologne until Saturday morning."
Diary 1954-1861,1854-07-28,17,42,N/A,"28. We went the first thing to the Church of St. Jacques - perhaps the finest thing we have seen on our journey. Forms, proportions, colouring-all is harmony, and we sat for half an hour wrapt in delicious contemplation. The delicate cream colour of the stone has an effect almost equal to that of marble in beauty- perhaps quite equal in its way. We came here again in the evening to hear the organ, but the Belgian voices which accompanied it or rather overpowered it prevented us from getting much extra enjoyment out of the music. The church warden's wife told us that some English artists had been engaged for 4 years in this church and had produced a thick quarto volume of drawings from it. Next to this delight came the Palais de Justice, formerly the palace of the Prince Bishop. The interior court with its colonnade of elaborately sculptured arches in grey stone is unique in my experience. One side has been restored and shews in perfection the varied patterns of the columns. We had a drive in an open carriage through the town to the Casino, a charming place with heights from which we had a fine view of Liege and its environs. On returning we saw the statue of Gretry. In the evening after going to St.Jacques we had another drive and then a farewell walk to our beloved Palais de Justice and to the Quay."
Diary 1954-1861,1854-07-29,17-18,42-43,N/A,"29. We set off by the 9 o'clock train for Cologne. The country from Liege to Vervier was striking} y beautiful. At Vervier Dr. Brabant joined us in our
carriage. Cologne looked very dismal as we passed through it in the omnibus on our way to the Hotel de Holland e. After dinner Dr. Brabant called to tell us that Strauss was residing in Cologne and would receive us the next morning at 9. We went with Dr. B. to see the Cathedral. When I entered itthe sight of the ugly wall which shuts out the choir - the proper vista of the nave, shocked me as one would be shocked by an ugly wooden arm attached to an exquisite marble torso. In the evening we had a ramble through the town, which looked more endurable by the soft evening light- but its grand characteristics are the multitude of churches and the multiplicity of smells . On our return we found
Dr. Brabant who came to tell us that Strauss would call on us in the morning."
Diary 1954-1861,1854-07-30,18,43,N/A,"30 Sunday. We breakfasted in the public room and were joined there by Dr. B. and Strauss. After a short interview with them we went on board the steamboat which was to take us to Coblentz. I did not expect much pleasure from [the) Rhine, so I took all that came with a good grace. In Coblentz I was rather disappointed, but it had still much beauty for me. The affectionate manners of
the waiter at the hotel (Trois Suisses) were amusing. The view from the bridge over the Moselle was a fine picture. So was that from our hotel windows looking on Ehrenbreitstein and the bridge ofboats. We remarked the great number of deformed people here. In one short evening walk we met 10 or 12 of them."
Diary 1954-1861,1854-07-31,18,43,N/A,"31. We set out again by the boat at 8 this morning, and had a delightful voyage. The banks of the Rhine from Coblentz to Mainz surpassed my expectations and seemed to me really to deserve Byron's praise. I fancy we saw the vines at the right moment- their green was so vivid. When they begin to turn yellow they must look rather forlorn, but the feathery hanging woods which clothe the hills here and there would shew best in Autumn. When we landed at Mainz, it began to rain, but we were brave enough to set out on a walk through the town, and were rewarded by a sight of the Nassau soldiery exercising- richer than any caricature in Punch. We were fairly driven back to the station by the rain and the smells, so we sat quietly awaiting the time of starting by the train to Frankfurt admiring the prim architectural looking bouquets on the table of the waiting room and getting by heart the German faces about us. In the same carriage with us were a Prussian Graf, who carried a loaf of black bread on his lap and talked to every one with great bonhomie, a Dutchman, and an Austrian with his wife. They talked, like every one else of the Turks and Russians. The Dutchman declared with great emphasis that England was much less beloved by Germany than Russia because she (England) was a more formidable rival in trade! -After a 'mauvais moment' waiting for our luggage we got into the omnibus and were carried to the Weidenbusch near the Rossmarkt, a very comfortable hotel."
Diary 1954-1861,1854-08-01,18,43,N/A,"Aug. 1. Tuesday. The first thing we did this morning was to go and see Goethe's statue by Schwanthaler and then his home in the Hirschgraben. Next we walked to the Judengasse; a striking scene! Next to the Staedel Museum, where the one thing never to be forgotten was Hübner's picture ofJob and his friends. Lessing's pictures - Ezzelin in prison and Huss before the Council of Constance - are meritorious but not thrilling. We unfortunately missed Overbeck's picture of Christianity triumphing over the Arts. We filled up our minutes before dinner by a second visit to Goethe's house, and a drive to the Bibliothek where we saw Marchesi's statue of Goethe and the portraits of Luther and his wife. In the evening we went to the Main Lust and heard some agreeable music."
Diary 1954-1861,1854-08-02,18-19,43-44,N/A,"2. Heavy and continuous rain kept us in our hotel till it was time to see
Dannecker's Ariadne. It stands in a pavilion in the garden ofHerr Bethmann, a wealthy banker. I never saw any sculpture equal to this - the feeling it excites is the essence of true worship- a bowing of the soul before power creating beauty. At 5 o'clock we set out on our 10 hours' journey to Weimar. The second class carriage was so comfortable, and the weather so lovely after the morning rains that the first half of our journey was delightful instead of fatiguing. The splendid view we had of Marburg by the setting sun was worth the whole journey. we got a little tired and leg-achy before we reached Weimar at 1/2 past 3, but after a little difficulty we got some tolerable beds at the Erbprinz and slept away our fatigue by 9 o'clock."
Diary 1954-1861,1854-08-03,19,44,N/A,"3rd. It was very pretty to look out of the window, when dressing, on a garden that reminded one of an English Village. Our walk in search oflodgings made us acquainted with the physiognomy of the town, which is more like a huge village or market town than the precinct of a court. We soon obtained some lodgings and here we are at 62a Kaufgasse at the house of Frau Mtinderloh, on the whole as comfortable as need be. In the evening we walked to Ober Weimarto see ""Der Posse als Medicin"" at the ""Tivoli Theater"", a little wooden structure in a garden."
Diary 1954-1861,1854-08-04,19,44,N/A,"4. We took possession of our lodgings this morning and had enough to do
before dinner in arranging our books etc. We pay 9 thalers per month for our lodgings. Our dinner at the Erbprinz is 12 1/2 groschen = about 15d. In the evening we happened, in our walk, to find the Erholung, where a concert was going forward. The walks in the garden are beautifully arched over with treesfirs chiefly which with their falling leaves make a matting that deadens the sound of one's footsteps - a great charm to me. We sat down among the company, made up almost entirely of women, most of them good-looking well dressed bourgeoises, chatting with an air of real friendliness over their knitting etc. When we came home I read some of L.'s M.S. aloud."
Diary 1954-1861,1854-08-05,19,44,N/A,"5 Sat. We read, wrote and walked a little before dinner. After, I read Sainte Beuve aloud. A letter from Mr. Chapman, proposing to me to write an article on Victor Cousin's Mde. de Sable. We ordered the book at the ""Hof-Buchhandlung"", a modest shop in the Markt Platz. In the evening we walked to Tiefurt, and were delighted with the grounds there."
Diary 1954-1861,1854-08-06,19,44,N/A,"6 Sunday. We wrote our letters and then walked out. Saw the outside of
Goethe's house in the Frauen Place. Dined for the first time at the Russischer Hof. Linenless, German. Our evening walk was to Belvedere, an enchanting place. A rumbling awkward carriage pronounced to be ""ein hübscher Wagen""."
Diary 1954-1861,1854-08-07,19,44,N/A,"7 Monday. Rainy. A pleasant walk in the Pare, notwithstanding. Read M.S. in the evening."
Diary 1954-1861,1854-08-08,19,44,N/A,"8 Tuesday. L. called on Scholl, and in the afternoon he (Scholl) came and took us to the Schloss where we saw the Dichter Zimmer."
Diary 1954-1861,1854-08-09,21,46,N/A,"Wednesday 9. We went to the little Tivoli Theatre and saw a ""star"" in Kotzebue's play - Der Arme Poet and Numero 726 a farce known in England as ""The Lottery Ticket."" In the morning L. called on Liszt."
Diary 1954-1861,1854-08-10,21-22,46-47,N/A,Box Link:  https://unl.box.com/s/4seo5i6lsd6zvlwggaz5tdwooyv51idz Omeka Link: https://georgeeliotarchive.org/admin/items/show/3151
Diary 1954-1861,1854-08-11,22,47,N/A,"Friday 11. We went to the Bibliothek with Hofrath Schöll, and looked at the
portraits and busts. The most remarkable among them is one in bronze of Gluck. The rugged power of the face is given with wonderful reality, as far as possible from the feeble idealization one generally sees in busts. There is a bust of Goethe, taken during his stay in Italy, which represents him as an Apollo. It is exquisitely beautiful but I cannot believe the brow to be accurate. Lessing's head and face are small, but of a fine, delicate type. Jacobi is rather feeble looking. We walked about with Schöll till it began to rain and then sought shelter with him under a door place. He is a genial unaffected man, full of accurate knowledge on all literary and philosophical subjects, and there is no German heaviness either in his appearance or his mind. In the morning L. called on Frau von Goethe."
Diary 1954-1861,1854-08-12,22,47,N/A,"12 Saturday. The morning being bright, we went to spend our day at Belvedere, the Grand Duke's Summer residence. It stands on the most considerable elevation in the immediate neighbourhood of Weimar, and is surrounded with lovely gardens which one enjoys all the more because they are free to all the good people of the town. The road to Belvedere is remarkable. It is one long avenue of stately trees. Just as we were going to leave, afters or 6 hours of quiet happiness, we met Schöll and turned back with him. He was presently joined by his wife whom we saw for the first time."
Diary 1954-1861,1854-08-[13],23,48,N/A,"12 [13] Sunday. Another glorious morning! But L.'s head is bad, and that makes us melancholy. We called on the Princess and strolled till dinner. Finished Cousin's book on Madame de Sable. In the evening we walked to Ober Weimar and satisfied ourselves that the village was very ugly."
Diary 1954-1861,1854-08-[14],23,48,N/A,"13 [14]. We devoted the day to an expedition to Ettersburg. On our return homewards the solemn grandeur of the Pine forest, in contrast with the sunbathed woods through which we had been passing, had a strong effect on us. The Chaussee has a bordering of cherry trees and mountain ashes. The
bunches of coral berries gladdened our eyes."
Diary 1954-1861,1854-08-[15],23,48,N/A,"14 [15] Tuesday. We had our names set down for the Table d'hôte at the
Erbprinz, by which means our dinners will only cost us 10 silver groschen each. Our expenses here, including wine and washing are £2.6 per week. Liszt called and sat chatting for an hour with me."
Diary 1954-1861,1854-08-[16],23,48,N/A,15 [16] Wednesday. I wrote to my sister and to Mr. Bray.
Diary 1954-1861,1854-08-[17],23,48,N/A,16 [17] Thursday. Liszt dined with us at the Erbprinz and came home with us to take coffee. Much pleasant chat. Afterwards L. and I walked to Belvedere.
Diary 1954-1861,1854-08-[18],23,48,N/A,17 [18] Friday. Nothing particular.
Diary 1954-1861,1854-08-[19],23,48,N/A,18 [19] Sat. Letter from Miss Parkes. Not well.
Diary 1954-1861,1854-08-[20],23,48,N/A,"19 [20] Sunday. L. called on Liszt, and went again in the evening."
Diary 1954-1861,1854-08-[21],23,48,N/A,20 [21]. Bad headache. Scholl called in the afternoon.
Diary 1954-1861,1854-08-[22],23,48,N/A,21 [22]. Head still bad. Walked to Belvedere and saw the Theatre in the garden.
Diary 1954-1861,1854-08-[23],23,48,N/A,22 [23] Wed. Better. Wrote a little. Invited to Liszt's but did not go. Went to the Vogel-schiessenin the evening and saw Punch etc.
Diary 1954-1861,1854-08-24,23,48,N/A,"24. Wrote all morning. Afternoon, went to Schiller's house. Stupidity of people tricking out and altering such a place instead ofletting one see it as he saw it and lived in it. I played on his little claveçin, in which lay his guitar; Vogel-schiessen, Punch."
Diary 1954-1861,1854-08-25,23,48,N/A,25. Goethe's House. Study and Bedroom.
Diary 1954-1861,1854-08-30,23,48,N/A,"30. Arthur Helps came yesterday to Weimar on his way to Dresden. L was with him all morning. He took coffee with us after dinner. In the evening we drove to Ettersburg, and he entertained us with charming stories about his Spanish travels."
Diary 1954-1861,1854-09-02,23,48,N/A,"Sep. 2. Saturday. I went with G. to Bercka for the first time. A little Elysium and the way to it very lovely. We dined al fresco in the presence of a pretty little meadow scene with holy oaks in the foreground. In returning, the evening was enchanting."
Diary 1954-1861,1854-09-03,23,48,N/A,"3 Sunday. Bad headache and unable to work. In the evening we went to Belvedere, and I saw several parts of the garden which were new to me."
Diary 1954-1861,1854-09-04,24,49,N/A,4. Mr Chapman's letter came to say that my article must be ready in London by the 10th.
Diary 1954-1861,1854-09-08,24,49,N/A,8. Sent off my article on Mme. de Sable. Went to Tiefurt in the evening.
Diary 1954-1861,1854-09-09,24,49,N/A,9. We went to Belvedere and spent the day there. Wrote Mr. Chapman.
Diary 1954-1861,1854-09-10,24,49,N/A,"10 Sunday. Wrote to Miss Parkes. Then we walked out in the fields towards Gelmeroda and sat in the sunshine. In the evening, to a party at Liszt's - Herrmann's conjuring the chief amusement. Medallion ofLiszt by Rietschl very fine."
Diary 1954-1861,1854-09-11,24,49,N/A,"11. Walked in the Webicht, and talked of art. In the afternoon we went to Jena. Much struck by the scenery. Slept at the Sonne."
Diary 1954-1861,1854-09-12,24,49,N/A,"12. Saw Goethe's rooms at the Tanne, now occupied by Dr. Widmann and his
wife, a niece of Neander's. We then walked up the Hausberg, and had an
enchanting view of the little village of Lichtenhain, nestled among trees in a lovely valley. The winding walk among the pines and firs, the wild flowers, the delicious air and the unclouded sky were intoxicating. The town of Jena is unmitigatedly dull and ugly, but Nature around it is enough to reconcile one to being there a short time. As we sat on the side of the hill, in ascending, the town looked very pretty and we heard scarcely a sound except the music of a band at various distances. We came home by a Wagen which started from the Sonne at 4. I was amazed at the beauty of the road, which I had not seen well as we went, from being shut up in a close Wagen. The evening sky was beautiful and we had full leisure to observe it, for we did not reach Weimar till 1/2 past 7. The little town looked more bright and cheety than ever after Jena."
Diary 1954-1861,1854-09-13,24,49,N/A,13 Wednesday. I was not at all well and overwalked myself by going to Belvedere in the evening. The Scholls and Sauppes were there.
Diary 1954-1861,1854-09-14,24,49,N/A,"14. Very unwell this morning, and glad in the afternoon to hear that Liszt
wished to put off our going to him. We had a delicious walk in the open fields, came home, and finished the M. S. of Goethe's life."
Diary 1954-1861,1854-09-16,24,49,N/A,16 Saturday. We went to the Weimar Theatre for the first time and heard Ernani.
Diary 1954-1861,1854-09-17,24,49,N/A,17. We deferred going to Ilmenau and passed the day quietly
Diary 1954-1861,1854-09-18,24,49,N/A,"18. Liszt came to dine with us at the Erbprinz and introduced M. Rubinstein, a young Russian, who is about to have an opera of his performed here."
Diary 1954-1861,1854-09-19,24,49,N/A,"19 Tuesday. We went to an evening party at Liszt's and heard the instrument, half organ, half piano, which he has had constructed for himself."
Diary 1954-1861,1854-09-20,24-25,49-50,N/A,"20. We set off for Ilmenau by railway. I read Liszt's account of""Der Fliegende
Hollander"" by the way. When we reached Neu Dietendorf, we had to get into the Post Wagen which turned out to be a disagreeable omnibus-like vehicle. At Arnstadt we were placed in a Beiwagen with two other passengers and had a pleasant view of the charming country all the way to Ilmenau. But the jolting vehicles and other désagréments had made us both ill and we could only crawl to our beds about 8 o'clock."
Diary 1954-1861,1854-09-21,25,50,N/A,21. We were better this morning but not equal to much walking. We rambled to a pretty stream and there sat watching a caterpillar. When it had been cut in two the fore-part set to work to devour the other hal£ In the afternoon we had a two hours' walk in the pine woods. They are sublime.
Diary 1954-1861,1854-09-22,25,50,N/A,"22. This morning we set out to find the Gabelbach. It rained a little, but still our walk was very pleasant. From the Gabelbach we went on to Kickelhahn, where Goethe's queer little wooden house stands. We wrote our names near one of the windows. The view ofhills from this point is very grand. We did exploits on our way home, not knowing the road, and were amused to find ourselves at last at the spot from which we had begun our uphill walk to the Gabelbach. In the evening we turned out again and walked to Elgersberg."
Diary 1954-1861,1854-09-23,25,50,N/A,23 Saturday. We went to Elgersberg and continued along the Chaussee till we came to Stutzerbach where we took a guide to Gabelbach. He took us up the hills through glorious pine and beech woods.
Diary 1954-1861,1854-09-24,25,50,N/A,"24 Sunday. We walked from Ilmenau to Arnstadt - a 4 hours' journey. The road is very fine and varied. Dined at the Goldene Henne, and had a boar's head splendidly decorated with green branches, a lemon in its mouth and a cross formed of carrot on its brow. We got the coupe of the Post Wagen and travelled comfortably to Neu Dietendorf, where we waited half an hour, for the train to Weimar. We reached home about half past 6 and enjoyed taking coffee snugly in our own lodgings once more. I read the Kestner letters at Ilmenau."
Diary 1954-1861,1854-09-25,25,50,N/A,"25. The morning looked so lovely that we were tempted to walk to Bercka, but it became very windy before we had been out long. The little valley looked more lovely than ever. We had a smart shower on setting out home, but were compensated by the sight of a lovely rainbow, which sprang from the very ground. It continued fine after this and we had a delicious evening walk."
Diary 1954-1861,1854-09-26,25,50,N/A,"26. In the afternoon we called at Herr Scholl's, had some pleasant chat with him and his wife, and then walked in the Park, Scholl accompanying us."
Diary 1954-1861,1854-09-27,25,50,N/A,"27. Mr Williams, an agreeable, unaffected young man, took coffee with us. In the evening we set out to go to Belvedere, but turned off into the open fields and found out a new walk. The sky was grand."
Diary 1954-1861,1854-09-28,25,50,N/A,"28 Thursday. The morning was too beautiful to be spent in doors, so we set out on the same walk that we had yesterday, and got atlastto Belvedere, where we went to look at the landscapes in the glass globes."
Diary 1954-1861,1854-09-29,25,50,N/A,29. In the afternoon the Princess Wittgenstein called and chatted pleasantly. G. then went to Mr. Wilson's to meet Eckermann.
Diary 1954-1861,1854-09-30,25,50,N/A,30. G. dined at the Marquis de Ferriere's.
